id,slug,name,parish,classification,status,lat,lng
st-jago-de-la-vega-cathedral,st-jago-de-la-vega-cathedral,Cathedral of St. Jago de la Vega,St. Catherine,cathedral,active,17.9965,-76.9574
kingston-parish-church,kingston-parish-church,Kingston Parish Church (St. Thomas the Apostle),Kingston,church,active,17.9673,-76.7936
st-james-parish-church-mobay,st-james-parish-church-mobay,St. James Parish Church,St. James,church,active,18.4807,-77.9188
st-peter-port-royal,st-peter-port-royal,"St. Peter's Church, Port Royal",Kingston,church,active,17.9377,-76.8403
st-anns-bay-parish-church,st-anns-bay-parish-church,St. Ann's Bay Anglican Church,St. Ann,church,active,18.4351,-77.2000
st-thomas-anglican-lacovia,st-thomas-anglican-lacovia,"St. Thomas Anglican Church, Lacovia",St. Elizabeth,church,active,18.0710,-77.6760
old-ruins-black-river,old-ruins-black-river,St. John the Evangelist (Old Ruins),St. Elizabeth,ruin,ruin,18.0260,-77.8510
treasure-beach-chapel,treasure-beach-chapel,Treasure Beach Mission Chapel,St. Elizabeth,chapel,active,17.8830,-77.7670
